<?xml version="1.0" encoding="UTF-8"?>
<!--Sample XML file generated by XMLSPY v5 rel. 3 U (http://www.xmlspy.com)-->
<settings xmlns:xsi="http://www.w3.org/2001/XMLSchema-instance" xsi:noNamespaceSchemaLocation="D:\Eclipse Workspace\js_workspace\products\jade\jade-vaadin-cockpit\src\main\resources\jadesettings.xsd">
	
	<globals>
		<params>
			<param name="test" value="test" />
		</params>
	</globals>
	
	<profiles>
		<profile name="local2ftp">
			<params>
				<param name="operation" value="send" />
			</params>
		</profile>
		<profile name="local2sftp">
			<includes>
				<include name="wilma_target_host" />
				<include name="wilma_target_user" />
				<include name="localhost_source" />
			</includes>
			<params>
				<param name="operation" value="send" />
			</params>
		</profile>
	</profiles>
	
	<fragments>
		<generals>
			<general name="MailSettings">
				<params>
					<param name="mail_on_error" value="true"></param>
				</params>
			</general>
		</generals>
		<sources>
			<source name="localhost_source">
				<params>
					<param name="host" value="localhost" />
				</params>
			</source>
		</sources>
		<targets>
			<target name="wilma_target_host">
				<params>
					<param name="host" value="wilma.sos" />
				</params>
			</target>
			<target name="wilma_target_user">
				<params>
					<param name="ssh_auth_method" value="password" />
					<param name="user" value="test" />
					<param name="password" value="12345" />
				</params>
			</target>
		</targets>
	</fragments>
	
</settings>
